id,isi,link,judul,images,tanggal
33,"Komunitas Wajah Jelita SMA Negeri 1 Seririt kembali melaksanakan webinar berbagi praktik baik “NARWAJITA”. Kegiatan yang berlangsung pada hari Kamis (21/3) kemarin mengangkat topik  Penerapan Pembelajaran Berdiferensiasi sebagai Esensi Implementasi Kurikulum Merdeka. Adapun narasumber yang mengisi kegiatan ini yaitu Kadek Thera Oktariyani, S.Pd., M.Pd (Guru Penggerak angkatan 7), Ni Nengah Tirta, S.Pd (Guru Penggerak angkatan 5), dan Ni Komang  Oktari Permata Sari (Guru Penggerak angkatan 5). \r\n\r\nKegiatan kali ini juga dihadiri oleh Pengawas Manajerial Gusti Nyoman Astika, S.Pd., M.Pd. Dalam sambutannya pihaknya menyampaikan apresiasi terkait kegiatan yang sudah dilakukan oleh Komunitas Wajah Jelita Smanser. Lebih lanjut pihaknya menegaskan bahwa guru diharapkan memiliki pemahaman yang baik secara teoretis maupun praktis terkait pembelajaran berdiferensiasi sesuai dengan esensi Kurikulum Merdeka.  \r\n\r\n“Guru diharapkan terus meningkatkan kualitas pelaksanaan pembelajarannya mulai dari refleksi awal, kemudian menyusun perencanaan, pelaksanaan, dan evaluasi dengan memastikan kebutuhan siswa terfasilitasi dengan baik atau pembelajaran yang berdiferensiasi”, ungkap Gusti Nyoman Astika. \r\n\r\nHal senada juga ditegaskan oleh Kepala SMA Negeri 1 Seririt Ngurah Putu Wiswayana, S.Pd., M.Pd yang menekankan bahwa peserta didik sejatinya memiliki minat bakat dan cita-cita yang berbeda-beda. Hal ini harus disadari oleh guru sehingga guru dituntut mmemfasilitasi pengembangan minat bakat dan cita-cita siswa. Guru pun juga demikian dalam melaksanakn pembelajaran diharapkan mampu memfasilitasi kebutuhan siswa.  \r\n\r\nKetiga pemateri secara pararel mengawali penyampaiannya mengenai konsep dan prinsip pembelajaran berdiferensiasi yang disampaikan oleh Kadek Thera Oktariyani.  Selanjutnya,  jenis diferensiasi yang meliputi diferensiasi konten, proses, dan produk disampaikan oleh Ni Nengah Tirta. Terakhir, Ni Komang Oktari Permata Sari menyampaikan mengenai contoh atau bentuk diferensiasi sesuai dengan jenisnya. Setelah pemaparan materi, acara pun disi dengan sesi tanya jawab untuk pendalaman (hms/mus)",https://www.instagram.com/p/C46k8qfS6Y8/?utm_source=ig_web_copy_link&igsh=MzRlODBiNWFlZA==,"??????? ????? ?????????, ?????? ????? ?????? ?????? ????? ???????????? ???????????????",43c13de957e188a3f92fc1ee060a4e7c.jpg,2024-03-22
34,"Kepada 5 orang siswa SMA Negeri 1 Seririt atas nama Phiong Marcell,  Kadek Budiartini, Ketut Padma Tribuana,  Naomi Himawari, dan Komang Ririn Triyanti yang telah berhasil lolos seleksi Olimpiade Sains Nasional (OSN) tingkat Kabupaten dalam bidang Informatika, Kimia, Astronomi, dan Kebumian. \r\n\r\nMereka juga sekaligus sebagai finalis dalam OSN tingkat provinsi jenjang SMA/MA/Sederajat tahun 2024. Semoga bisa sukses di tingkat provinsi. ",https://www.instagram.com/p/C55nTGprEqS/?utm_source=ig_web_copy_link&igsh=MzRlODBiNWFlZA==,??????? & ??????,c3acc0d2f503e9ec3d6c597253a8da54.jpg,2024-04-19
35,"Pengembangan lingkup cita-cita mengacu minat dan bakat atau yang dikenal Pelita Memikat yang dilaksanakan SMA Negeri 1 Seririt (Smanser) membuahkan hasil positif. Sebanyak 42 siswa lolos masuk perguruan tinggi jalur Seleksi Nasional Berbasis Prestasi (SNBP), 1 orang diantaranya diterima pada Fakultas Kedokteran Hewan Universitas Udayana, dan 1 orang di Prodi Kebidanan Fakultas Kedokteran Undiksha. \r\n\r\nJumlah siswa yang lolos SNBP tahun ini meningkat drastis jika dibandingkan dari tahun 2023. Tahun lalu hanya 22 siswa yang berhasil lolos sedangkan tahun ini sebanyak 42 orang. Mayoritas diterima di Universitas Pendidikan Ganesha dan Universitas Udayana, dan ada juga di Politeknik Energi dan Pertambangan Bandung.\r\n\r\nKepala SMA Negeri 1 Seririt Ngurah Putu Wiswayana, S.Pd.,M.Pd dalam sambutannya ketika bertatap muka langsung dengan seluruh siswa yang lolos SNBP pada Senin (1/4) kemarin mengungkapkan rasa syukurnya sekaligus mengucapkan selamat kepada siswa yang sudah lolos.\r\n\r\n“Keberhasilan ini menandakan bahwa anak-anak sudah semakin tepat dalam memilih prodi yang diinginkan dengan mempertimbangkan kuota atau daya saing. Selama ini sekolah berupaya memfasilitasi cita-cita anak-anak dengan program Pelita Memikat dan juga Bimbingan Smanser (Bimser) agar anak-anak terbantu dalam meraih cita-citanya. Syukurnya  program ini berdampak positif ke anak-anak” ungkap Kasek Wiswayana. \r\n\r\nSalah satu siswa Putu Widyantari yang diterima di Prodi Bimbingan Konseling Undiksha menyampaikan terima kasih kepada lembaga yang sudah mengadakan program seperti Pelita Memikat dan Bimser. Sebelum mengikuti program tersebut dirinya mengakui bingung untuk memilih jurusan. Dengan mengikuti program tersebut selama ini dirinya mendapatkan banyak informasi, bimbingan, dan tips dalam memilih jurusan di perguruan tinggi. \r\n\r\n“Saya merasakan  sekali manfaat dari program sekolah selama ini seperti Bimser dan Pelita memikat. Awalnya saya bingung mau memilih jurusan apa. Tetapi dengan adanya program ini dan konseling dengan guru BK saya lebih mantap  dalam menentukan pilihan dan akhirnya syukur bisa diterima di SNBP”, ungkap Widyantari. (hms/mus)",https://www.instagram.com/p/C5P6b9BrKJJ/?utm_source=ig_web_copy_link&igsh=MzRlODBiNWFlZA==,?????? ??????? ??? ?????? ???????? ?? ????? ??????? ????? ????? ???? ????,0098c7cb7901897536c569ac03e4c5f1.jpg,2024-04-02
36,"SERIRIT - Dalam rangka mengakhiri program pendidikan khususnya bagi peserta didik kelas XII Tahun Pelajaran 2023/2024, SMA Negeri 1 Seririt melaksanakan kegiatan Pelepasan. Kegiatan berlangsung di aula sekolah pada Jumat (19/4) tadi dan dihadiri oleh Camat Seririt yang diwakili oleh Kasi Sosial dan Budaya, Danramil, Kapolsek, Lurah, Pengurus Komite, guru, pegawai, dan seluruh siswa kelas XII. \r\n\r\nKepala SMA Negeri 1 Seririt Ngurah Putu Wiswayana, S.Pd.,M.Pd dalam sambutannya mengatakan bawah acara pelepasan merupakan acara rutin yang dilaksanakan setiap tahun. Kepada anak-anak kelas XII yang dilepas dan sebentar lagi menjadi lulusan pihaknya berharap agar bisa menjadi lulusan yang cerdas, memiliki jiwa kompetitif, dan berwawasan lingkungan seperti visi sekolah. Selama ini SMA Negeri 1 Seririt sebagai Sekolah Penggerak menerapkan Kurikulum Merdeka dengan  program pendidikan yang yang mengacu pada kebutuhan anak. Sekolah sudah memfasilitasi siswa dengan program Bimser, Pesona, Pelita Memikat, dan program lainnya. Dengan program tersebut capaian sekolah dalam SNBP pun meningkat dari tahun sebelumnya yaitu sebanyak 42 orang dalam tahun ini. Pihaknya berharap seluruh siswa yang dilepas bisa sukses meraih cita-cita. \r\n\r\nKetua Komite SMA Negeri 1 Seririt Made Yasa Sumendra, S.Pd.,M.Pd mengatakan bahwa dirinya mewakili seluruh orang tua/wali siswa kelas XII menyampaikan rasa terima kasih yang mendalam kepada jajaran manajemen sekolah dan seluruh pendidik yang telah mendidik siswa dengan baik, begitu juga tenaga kependidikan yang telah memberikan pelayanan administrasi. Selama mendidik dengan segala kekurangan dan kelebihan, pihaknya memohon maaf jika ada hal-hal yang menjengkelkan atau kurang berkenan di hati guru atau pegawai. Semoga para lulusan nantinya dapat membanggakan sekolah. \r\n\r\nSementara itu, Kasi Sosial dan Budaya Kecamatan Seririt Gede Yasa, S.Ag mewakili Camat Seririt  menyampaikan selamat kepada seluruh siswa karena sudah dapat mengikuti pendidikan dengan baik selama 3 tahun yang pastinya dilewati dengan suka dan duka. Ke depan siswa harus tetap semangat dalam meraih cita-cita. Dalam merayakan Pelepasan, pihaknya mengimbau agar siswa tidak mengisinya dengan cara yang berlebihan sehingga tidak merugikan diri sendiri dan orang lain. Pihaknya juga menyampaikan terima kasih kepada seluruh guru di SMA Negeri 1 Seririt karena sudah mendidik generasi Indonesia yang akan membawa perubahan ke depannya.\r\n\r\nUntuk diketahui, acara pelepasan diawali dengan penampilan Tari Kebesaran Padma Widya yang berhasil memukau seluruh peserta yang hadir dilanjutkan dengan sambutan dari para undangan, penandatangan berita acara, kemudian acara hiburan yang diisi dengan beberapa penampilan dari siswa. (hms/mus)",https://www.instagram.com/p/C5_D37oPMbZ/?utm_source=ig_web_copy_link&igsh=MzRlODBiNWFlZA==,????????? ????? ????? ??? ??? ?????? ? ??????? ????? ????????? ????/????,0892e2b85d8bb2ab3ad094bd13fea137.jpg,2024-04-20
37,"SERIRIT - Dalam rangka memperingati Hari Kesiapsiagaan Bencana Tahun 2024, SMA Negeri 1 Seririt melaksanakan simulasi/latihan evakuasi mandiri secara serentak. Kegiatan diikuti oleh seluruh warga sekolah mulai dari guru, pegawai, dan seluruh siswa pada Jumat (26/4) pagi tadi. \r\n\r\nSelama pelaksanaan simulasi seluruh warga sekolah terpantau mengikuti dengan baik. Siswa yang awalnya belajar di masing-masing kelas dengan cekatan melindungi diri di bawah meja ketika mendengar sirine pada pukul 10.00 Wita. Setelah situasi dirasa lebih aman, siswa pun bergegas menuju jalur evakuasi dan titik kumpul dengan tetap melindungi kepala. Setelah berada di titik kumpul ketua kelas melaporkan  kelengkapan temannya kepada tim siaga bencana untuk selanjutnya dilakukan evakuasi ketika ada yang tertinggal. \r\n\r\nWaka Humas I Kadek Mustika, S.Pd.B., M.Pd  yang juga selaku koordinator kegiatan ketika memberikan evaluasi pelaksanaan simulasi menekankan kembali terkait potensi rawan bencana sehingga setiap warga sekolah harus selalu tanggap dengan bencana. Dengan melakukan simulasi bencana warga sekolah diharapkan bisa terlatih dalam mitigasi bencana untuk mengurangi risiko atau dampak ketika bencana sewaktu-waktu benar terjadi. \r\n\r\nPihaknya menegaskan SMA Negeri 1 Seririt ikut mendukung program Satuan Pendidikan Aman Bencana (SAPB). Selama ini koordinasi tetap dilakukan dengan pihak-pihak terkait seperti Badan Meteorologi dan Geofisika (BMKG) Stasiun Geofisika Denpasar dan  BPBD Buleleng. Pelatihan simulasi bencana pun pernah diberikan oleh kedua instansi tersebut dan diikuti oleh warga sekolah (hms/mus).",https://www.instagram.com/p/C6OvmsFvQrR/?utm_source=ig_web_copy_link&igsh=MzRlODBiNWFlZA==,"????????? ???? ????????????? ???????, ??????? ????? ???????? ???????? ???????",bf6d96c60806a5a20c1e16476751d5b7.jpg,2024-04-26
38,"Dalam rangka meningkatkan sradha bakti dan mengembangkan kreativitas seni, Tim  Kesenian Smanser ngaturang ayah serangkaian Pujawali Pura Segara Rupek pada hari Sabtu (27/4). Pada kesempatan ini Tim Kesenian Smanser menampilkan beberapa tarian seperti Tari Palawakia, Tari Rejang, dan Tari Padma Widya yang dibawakan oleh para guru, pegawai, dan siswa Smanser. \r\n\r\nKoordinator Tim Ketut Sukariani, S.Pd didampingi  I Putu Eka Julyana Putra, S.Sn mengatakan bahwa kegiatan ini terlaksana karena keinginan yang kuat dan semangat dari anak-anak khususnya ekstrakurikuler Tari dan Tabuh agar bisa ngaturang ayah. Kegiatan seperti ini juga sudah beberapa kali dilaksanakan sejak dulu. “Kegiatan ini terlaksana karena semangat  anak-anak Smanser serta  didukung oleh lembaga” ungkapnya.\r\n\r\nSementara itu, Kepala SMA Negeri 1 Seririt Ngurah Putu Wiswayana,S.Pd.,M.Pd mengatakan bahwa pihaknya menyambut positif keinginan dari warga sekolah untuk ngaturang ayah dengan menampilkan seni keagamaan seperti tari dan tabuh. Pertama, hal ini sesuai dengan misi sekolah yang salah satunya fokus pada pengembangan seni budaya seperti tari dan tabuh. Kedua, kegiatan seperti ini juga sejalan dengan tujuan pemerintah untuk mewujudkan Profil Pelajar Pancasila yaitu bertakwa kepada Tuhan Yang Maha Esa  dan berakhlak mulia yang dilakukan melalui pengembangan minat dan bakat. (hms)",https://www.instagram.com/p/C6Y9E9SP0-p/?utm_source=ig_web_copy_link&igsh=MzRlODBiNWFlZA==,??? ???????? ??????? ?????? ??????????? ???????? ???? ?????? ?????,c9e20918e94fbe578fe394a04fc1cf85.jpg,2024-04-29
39,"Dalam rangka memperingati Hari Pendidikan Nasional (Hardiknas) 2024 SMA Negeri 1 Seririt melaksanakan upacara  pada Kamis (2/5) pagi tadi. Upacara diikuti oleh seluruh warga sekolah dengan mengenakan pakaian adat. Bertindak sebagai pembina upacara Waka Kurikulum Wayan Suarsa, S.Pd.\r\n\r\nDalam sambutannya, pembina upacara membacakan sambutan dari Mendikbudristek RI Nadiem Anwar Makarim yang menekankan transformasi pendidikan yang sudah dilakukan di Indonesia yang dikenal dengan gerakan Merdeka Belajar. Gerakan ini dipandang sudah berhasil memberikan ruang bagi insan pendidikan untuk berekspresi dan menunjukkan karya-karya yang inovatif. \r\n\r\nDengan langkah yang dipandang sudah benar diharapkan gerakan ini bisa dilanjutkan sebagai perjalanan ke arah perwujudan sekolah yang dicita-citakan. Mendikbudristek mengapresiasi perjuangan para insan pendidikan, para penggerak perubahan untuk membawa Indonesia melompat ke masa depan. (hms)",https://www.instagram.com/p/C6gJME1L7o-/?utm_source=ig_web_copy_link&igsh=MzRlODBiNWFlZA==,??????? ?????????? ???? ?????????? ???????? (?????????) ????,df14c61175dac05cf7c9d9df80ef0118.jpg,2024-05-02
40,"SMA Negeri 1 Seririt kembali melaksanakan pagelaran Projek Penguatan Profil Pelajar Pancasila (P5) dengan tema berekayasa dan berteknologi untuk membangun NKRI. Kegiatan berlangsung di Aula pada Senin (6/5) pagi tadi. Acara dihadiri oleh Pengurus Komite , perwakilan orang tua siswa, serta seluruh warga sekolah.  \r\n\r\nKetua panitia Ida Ayu Kade Suarmika, S.Pd mengatakan bahwa projek pada siswa kelas X ini dalam pelaksanaannya sebenarnya  lebih fokus pada prosesnya dengan mengembangkan nilai-nilai seperti bergotong royong, bernalar kritis, dan kreatif. Meskipun demikian, pada akhir projek siswa juga ternyata mampu menghasilkan beberapa produk hasil inovasi dari siswa.\r\n\r\nAda beberapa produk yang ditampilkan dalam pagelaran seperti  hidroponik dengan kreasi kolam ikan dengan memanfaatkan bahan dari botol bekas, hidroponik eco tower, mesin pemotong rumputesin pemotong sayur, mesin pemotong bawang, sapu bulu elektronik, mesin penangkap nyamuk, miniatur pendeteksi gempa, pendeteksi kesuburan tanah, pendeteksi kebakaran, pendeteksi banjir, mixer, miniatur pembangkit listrik tenaga air, fotografi, game sederhana dgn aplikasi MIT companion, aplikasi game Bahasa Inggris dengan Scratch, penyaring air sederhana dan lain-lain. (hms)",https://www.instagram.com/p/C6pqMPMP6FO/?utm_source=ig_web_copy_link&igsh=MzRlODBiNWFlZA==,??????? ??????? ????????????? ????????? ?????? ????????? ?????? ??????? ????????? (??),894be9b47b5c19172cade1229f6c8bde.jpeg,2024-05-06
41,"Dua siswa Smanser terpilih untuk mengikuti Konferensi Pemuda Bali yang diselenggarakan  oleh BASAbali Wiki bekerjasama dengan Disdikpora Provinsi Bali di Hotel Inna Bali Heritage  Renon Denpasar pada tanggal 6 & 7 Mei 2024. Kegiatan dihadiri oleh perwakilan pemuda/siswa, guru, OPD, Pasikian Yowana Bali, DPR, MDA, dan  PHDI. \r\n\r\nSiswa atas nama Gede Ariawan dan Ida Ayu Putu Yuliana Kartika Utami terpilih bersama perwakilan dari 5 sekolah di masing-masing kabupaten/kota melalui seleksi Wikhiton Partisipasi Publik. Turut mendampingi guru bahasa Bali I Kadek Mustika, S.Pd.B., M.Pd. \r\n\r\nKegiatan  dibuka oleh PJ Gubernur Bali yang diwakili oleh Kepala Dinas Kebudayaan Provinsi Bali Prof. Dr. I Gede  Arya Sugiartha. Selama kegiatan peserta diberikan beberapa materi seperti identifikasi dan penyelesaian masalah melalui permainan peran, workshop menulis persuasif dan media digital untuk advokasi, yoga, succes story dari tokoh inspiratif, FGD metodologi dan isu prioritas, deklarasi, dan penandatanganan komitmen bersama.\r\n\r\nPada akhir kegiatan, para peserta juga dikukuhkan menjadi Yowana Abinaya yang nantinya akan ikut berkontribusi dalam kebijakan pemerintah.(hms)",https://www.instagram.com/p/C6u6E9irBRq/?utm_source=ig_web_copy_link&igsh=MzRlODBiNWFlZA==,??? ????? ??????? ????? ?????????? ?????? ???? ????,4f1fa0bc21655c89c63c74be7fa6dedf.jpg,2024-05-08
42,Bagi adik-adik kelas IX SMP atau masyarakat yang ingin mengetahui informasi PPDB SMA Negeri 1 Seririt Tahun Pelajaran 2024/2025 dimohon untuk mencermati infografis berikut ini. Hal-hal yang belum jelas bisa cek info lebih lanjut atau ditanyakan ke Posko PPDB SMA Negeri 1 Seririt setiap hari kerja. \r\n\r\nTerima kasih,https://www.instagram.com/p/C7T9CBevtpJ/?igsh=MzRlODBiNWFlZA==,???? ??? ?????? ? ??????? ?? ????/????,83d067a9b6d2bb78504cc94d2405bfd3.jpg,2024-05-23
43,"SERIRIT - Dalam rangka meningkatkan kemampuan literasi di kalangan siswa, Perpustakaan Widya Mandala SMA Negeri 1 Seririt kembali menyelenggarakan lomba membaca kritis. Lomba yang berlangsung di ruang perpustakaan pada Jumat (31/5) lalu diikuti oleh 21 siswa perwakilan dari masing-masing kelas.\r\n\r\nSebelum pelaksanaan lomba, semua peserta  diberikan arahan terkait dengan teknis lomba. Dalam lomba siswa diajak untuk menjawab pertanyaan yang jawabannya ada pada literatur tertentu. Berdasarkan keterangan salah satu dewan juri Ida Ayu Kade Suarmika, S.Pd secara umum siswa sudah mampu membaca kritis namun harus terus ditingkatkan lagi.  \r\n\r\nKepala Perpustakaan Widya Mandala SMA Negeri 1 Seririt Sang Ayu Made Rasmini, S.Pd., M.Ag  mengatakan bahwa tujuan diadakannya lomba ini yaitu untuk meningkatkan minat baca, menambah wawasan, membiasakan pemanfaatan perpustakaan, dan meningkatkan jumlah pengunjung. Selama ini, pihaknya sudah merancang beberapa program dalam rangka meningkatkan kemampuan literasi diantaranya lomba karya ilmiah, pembuatan karya inovasi guru berupa PTK atau buku, lomba membaca kritis, pembinaan membaca bagi anak yang masih mengalami kendala baca, pemilihan duta literasi, dan pengadaan buku. \r\n\r\nKepala SMA Negeri 1 Seririt Ngurah Putu Wiswayana, S.Pd., M.Pd mengatakan pihaknya selaku pimpinan lembaga sangat komitmen dalam memajukan literasi di sekolah. Hal ini dibuktikan dengan diselenggarakannya berbagai kegiatan literasi secara berkesinambungan. Tidak lupa, dalam pelaksanaan program-program perpustakaan dukungan pembiayaan juga selama ini terus dioptimalkan. (hms/mus)",https://www.instagram.com/p/C7wgRMnP1oD/?utm_source=ig_web_copy_link&igsh=MzRlODBiNWFlZA==,"?????????? ????????? ????????, ???????????? ????? ??????? ??????? ????? ????? ??????? ??????",83bd683b471bc57535de25427eb4c24f.jpg,2024-06-03
44,"Puluhan warga SMA Negeri 1 Seririt  mengikuti acara Sosialisasi Uji Kemahiran Berbahasa Indonesia (UKBI) pada Senin (3/6) pagi tadi. Acara yang berlangsung di RKG ini dihadiri oleh kepala sekolah, staf pimpinan, guru, dan puluhan siswa. Adapun narasumber dalam kegiatan ini yaitu  I Nyoman Sutrisna, S.S., M.Hum sekalu Kepala Subbagian Umum Balai Bahasa Provinsi Bali.  \r\n\r\nKepala SMA Negeri 1 Seririt  Ngurah Putu Wiswayana, S.Pd., M.Pd. dalam sambutannya mengatakan pihaknya sangat  mengapresiasi kehadiran tim dari Balai Bahasa Provinsi Bali yang akan memberikan sosialisasi. Dengan informasi yang diberikan, pihaknya berharap siswa SMA Negeri 1 Seririt banyak yang bisa mengikuti UKBI, demikian juga untuk para guru. “Terima kasih atas kehadiran tim dari Balai Bahasa Provinsi Bali yang sudah memenuhi undangan kami, nanti kami akan dorong siswa untuk mengikuti UKBI"" ungkap Kasek Wiswayana. \r\n\r\nSementara itu, I Nyoman Sutrisna, S.S., M.Hum dalam paparan materinya mengatakan bahwa UKBI  menjadi alat uji yang dapat mengukur keterampilan berbahasa, baik reseptif maupun produktif serta pengetahuan dan pemahaman penerapan kaidah bahasa Indonesia. Lebih lanjut dikatakan bahwa  UKBI ini penting untuk memetakan kemahiran siswa dalam berbahasa Indonesia. “UKBI ini penting diikuti oleh punutur jati bahasa Indonesia untuk memetakan kemahiran berbahasa sehingga kami harap banyak siswa disini yang ikut” ungkapnya. \r\n\r\nSelain menyangkut gambaran umum, narasumber juga menyampaikan  hal teknis atau  tata cara dalam mengikuti UKBI. Simulasi juga diberikan kepada para peserta untuk memberikan gambaran soal yang akan dihadapi dalam mengikuti UKBI. Setelah dua jam pemaparan, acara pun diakhiri dengan sesi  foto bersama. (hms/mus)",https://www.instagram.com/p/C7wge3VvgLA/?utm_source=ig_web_copy_link&igsh=MzRlODBiNWFlZA==,??????? ????? ??????? ????? ??????????? ??? ????????? ????????? ????????? (????),d24ee3eaa09ee3874944d2060be51bba.jpg,2024-06-03
45,"Puluhan guru SMA Negeri 1 Seririt melaksanakan diskusi visi dan prakarsa perubahan dalam acara Pendampingan Individu 2 Calon Guru Penggerak Angkatan 10 pada Selasa (4/6) pagi tadi.  Adapun CGP tersebut yaitu Ni Wayan Budiari, S.Pd., Ni Wayan Muliantari, S.Pd., Kadek Juni Artawan, S.Pd., Kadek Parmayasa, S.Pd., dan Gede Aan Karisma, S.Pd. Kegiatan dipimpin oleh Pengajar Praktik dari masing-masing CGP dan dihadiri juga oleh kepala sekolah dan staf pimpinan. \r\n\r\nDalam kegitan diskusi yang berlangsung selama dua jam, para peserta diskusi sepakat bahwa visi sekolah yaitu Cerdas, Kompetitif, dan Berwawasan Lingkungan masih selaras dengan visi Kemendikbudristek dan cita-cita untuk murid.  Dalam mewujudkan visi perlu kolaborasi dari seluruh stakeholder, baik kepala sekolah, guru, siswa, dan orang tua. Seluruh peserta juga sepakat bahwa pengembangan karakter,  minat, bakat, dan cita-cita siswa adalah hal penting yang harus diupayakan bersama. \r\n\r\nDitanya mengenai keikutsertaan guru SMA Negeri 1 Seririt dalam Program Guru Penggerak, Kepala SMA Negeri 1 Seririt yang juga selaku Pengajar Praktik Ngurah Putu Wiswayana, S,Pd.,M.Pd mengatakan bahwa guru SMA Negeri 1 Seririt sudah  banyak yang lolos dalam PGP . Hal ini tentunya menjadi aset bagi sekolah untuk terus bisa bergerak mewujudkan visi sekolah. \r\n\r\nUntuk diketahui, sampai saat ini 9 guru SMA Negeri 1 Seririt telah berhasil menyandang status sebagai Guru Penggerak yaitu Ni Nengah Tirta, S.Pd., Wayan Suarsa, S.Pd ., Ni Kadek Thera Oktariyani, S.Pd.,M.Pd., Kadek Tuti Andayani, S.Pd., Ni Putu Sri Astuti, S.Pd., Ni Komang Oktari Permata Sari, S.Pd., Komang Suardika, S.Pd., Ni Gusti Ayu Kade Yogi P. , S.Pd., Ida Kade Surya Adnyana, S.Pd. (hms/mus)",https://www.instagram.com/p/C70SLJJv8RO/?utm_source=ig_web_copy_link&igsh=MzRlODBiNWFlZA==,???????????? ???????? ? ????? ???? ????????? ???????? ??,211033143684709340f75f21ae9c8fc1.jpg,2024-06-04
46,"Dalam rangka meningkatkan solidaritas dan kekompakan antarsiswa,  SMA Negeri 1 Seririt melaksanakan kegiatan outbond yang dipusatkan di lapangan sekolah pada Rabu (5/6) pagi tadi. Kegiatan diisi dengan berbagai perlombaan seperti lomba magoak-goakan, lomba estafet gelas, lomba memindahkan tictac, lomba makan kerupuk,  dan lomba estafet karet.\r\n\r\nSebelum kegiatan dimulai, siswa seperti biasa mengikuti apel pagi  untuk menerima pengarahan terkait kegiatan yang akan diikuti, baik yang lomba antarkelas maupun antarangkatan. Selanjutnya, warga sekolah juga diajak  melaksanakan TM  (transcendental meditation) secara bersama-sama. Hal ini merupakan program sekolah yang dilaksanakan secara rutin.  \r\n\r\nSelama kurang lebih dua jam berlangsung kegiatan outbond terpantau berlangsung dengan meriah dan menyenangkan. Masing-masing perwakilan dengan semangat mengikuti seluruh rangkaian lomba. Kemeriahan ini juga ditambah dengan keseruan para suporter dari masing-masing kelas yang memberikan dukungan pada perwakilannya. \r\n\r\nKetua OSIS Nyoman Satya Wiguna yang memandu jalannya kegiatan mengatakan bahwa tujuan dilaksanakannya beberapa lomba tersebut adalah untuk memupuk rasa persaudaraan antarsiswa. Dirinya mencontohkan seperti lomba magoak- goakan yang diikuti oleh masing-masing angakatan,  tentunya satu tim terdiri atas beberapa siswa dari kelas yang berbeda beda. Oleh karena itu mereka bisa saling berkomunikasi, berkerja sama satu sama lain, menyusun strategi dengan matang, sehingga bisa memberikan hasil yang maksimal. “Lomba ini pada intinya untuk meningkatkan rasa kebersamaam dan kekompakkan dan juga bagian dari penguatan profil pelajar Pancasila” ungkap Satya. (hms/mus)",https://www.instagram.com/p/C71gReEv9WW/?utm_source=ig_web_copy_link&igsh=MzRlODBiNWFlZA==,"?????????? ???????? ?????? ??????, ????? ??????? ????? ???????",2320ad9888297fb1e2af5e14323bd48a.jpg,2024-06-05
47,"Dalam rangka mendukung program pemerintah khususnya tertib administrasi kependudukan, SMA Negeri 1 Seririt memfasilitasi kegiatan Perekaman KTP elektronik yang dilaksanakan oleh Dinas Kependudukan dan Catatan Sipil Kabupaten Buleleng. Kegiatan yang menyasar siswa umur 16 tahun ke atas ini dilaksanakan pada Jumat (31/5) lalu dan  Rabu (5/6) tadi.  Selama kegiatan perekaman yang berlangsung 2 kali terdata sebanyak 230 siswa telah mengikuti perekaman.  \r\n\r\nKepala SMA Negeri 1 Seririt melalui Waka Humas I Kadek Mustika mengatakan bahwa kegiatan perekaman KTP elektronik  ini memang secara periodik dilaksanakan di sekolah. Dengan didatangi langsung oleh tim perekaman dari Disdukcapil Kabupaten Buleleng tentunya akan mempermudah siswa untuk mengikuti perekaman. Selain perekaman KTP el, sekolah juga mendukung program Identitas Kependudukan Digital (IKD) yang sejalan dengan program digitalisasi saat ini.  (hms)",https://www.instagram.com/p/C71KDWuPiO8/?utm_source=ig_web_copy_link&igsh=MzRlODBiNWFlZA==,????????? ??? ?? ???? ????? ???? ?? ????? ?? ????,0519b8a92749c992e80783ecd8cc4e09.jpg,2024-06-05
